Title,IMDB ID,Date of release,Genre1,Genre2,Genre3,Language,Actor1,Actor2,Actor3,Crew1,Crew2,Crew3,Plot summary,IMDB rating,IMDB votes,IMDB URL
Hum Intezaar Karenge,363691,1989,Drama,Romance,NA,Hindi,Mithun Chakraborty,Padmini Kolhapure,Vinod Mehra,Jadab Bhattacharya,NA,NA,"Manisha is the only child of wealthy widower Barrister Vikas Anand. Manisha meets fellow collegian, Ajay, and after a few misunderstandings both fall in love with each other. Manisha introduces Ajay to her dad, who approves of him, but Ajay tells him that he cannot marry Manisha until he is well settled and able to afford all the comforts of life, he needs 3 years to accumulate enough wealth and then marry Manisha. Vikas is impressed by this and agrees to wait, subsequently Manisha also agrees. Ajay keeps Manisha posted about his success story. However, after the period of 3 years, Ajay disappears from Manisha's life. Her friend informs Manisha that she knows that Ajay has married another woman, and shows her photographs of Ajay and the woman. Watch as events unfold to show why Ajay chose to marry another woman, and what steps will Manisha and her dad take to hold Ajay accountable for his promise.",5.5,27,https://www.imdb.com/title/tt0363691/
Patita,316386,1980,Drama,NA,NA,Hindi,Shoma Anand,Vikram Makandar,Raj Kiran,NA,NA,NA,"A young woman, forced to live the life of sex worker after the death of her parents, loses her faith in life and human beings in general when her brother dies. Three young persons fall in love with her, a spoilt alcoholic who lives life on the edge and dies as a result of excessive alcoholism, a schoolteacher who involuntarily is made responsible for the death of the lady's school going brother, and the college student whose simplicity and naivet wins the heart of the sex worker. Amidst parental pressure and social obstacles, the student marries the sex worker, thus completing the cycle of life and giving her societal respect.",5.8,26,https://www.imdb.com/title/tt0316386/
Badnam Farishte,384822,1971,Crime,Drama,NA,Hindi,Rajesh Khanna,Sharmila Tagore,Sona Mastan Mirza,NA,NA,NA,NA,5.8,22,https://www.imdb.com/title/tt0384822/
Apna Bana Lo,247933,1982,Drama,Family,NA,Hindi,Jeetendra,Rekha,Amrish Puri,NA,NA,NA,"Orphaned at a very young age, not aware of his religion nor his background, a young man is taken-in by a gangster and trained to accept crime as his career. This young man grows up to be a dreaded gangster himself by the name of Master. He works for another rich and powerful gangster by the name of Paul, who assigns him work for hefty fees. One day Master comes across an abandoned child, and decides to adopt the child. This changes his life, and he decides to go straight and give up on all criminal activities. That's when he finds out that getting honest employment is a lot more difficult that living a life of crime. Just when he is about to give up, he witnesses some men attempting to molest a woman, and he comes to her rescue. This woman is a well-known artiste by the name of Roopadevi, who decides to help Master out, and gives him a loan to open his own garage. When Paul attempts to bring Master back to his criminal world, Master turns him down. A few days later, the police raid Master's house and confiscate illicit drugs, and Master is arrested and held for trial. Roopa again helps Master out, but this time Master has made a new enemy - in the shape and form of Mr. Joshi, Roopa's mentor, who wants Roopa and her wealth for himself, and will do anything to get Master out of the way.",5.7,28,https://www.imdb.com/title/tt0247933/
Pran Jaye Par Vachan Na Jaye,70558,1974,Action,Drama,Musical,Hindi,Sunil Dutt,Rekha,Bindu,Agha Jani Shirazi,NA,NA,"Raja Thakur (Sunil Dutt) is an outlaw who fights oppression and corruption in his own unique way. This Robin Hood like figure is a feared and respected figure among the villagers and when he attends a dance performance given by the famous dancer Janiya (Rekha), he finds himself attracted to her. He shows his feelings openly but this proves to be a hindrance to Janiya - people now consider her to be the exclusive property of the outlaw and fear to ask her to perform for them. A rival gang kidnaps Janiya and invoke the wrath of Raja Thakur. Now Raja Thakur will have to leave the rural area, where he rules, and go into an unknown territory, to deal with unknown gangsters, and he must do so in order to keep his word.",6,29,https://www.imdb.com/title/tt0070558/
Taxi Chor,81605,1980,Crime,Thriller,NA,Hindi,Indira Bansal,Master Bhagwan,Abhi Bhattacharya,NA,NA,NA,NA,5.4,23,https://www.imdb.com/title/tt0081605/
Humshakal,231765,1992,Action,Comedy,Drama,Hindi,Shammi Kapoor,Vinod Khanna,Meenakshi Sheshadri,Menon Mohd. Yusuf,NA,NA,NA,5.3,26,https://www.imdb.com/title/tt0231765/
Paisa Yeh Paisa,419005,1985,Action,Crime,Drama,Hindi,Bindu,Gulshan Grover,Nivedita Joshi,NA,NA,NA,After death of his first wife Sukhiram married Shanti so his son Shyam could get a mother.Shanti disowns Shyam for being a stepson while her kids Guddu and Meena also grow up to be like her.Shanti and her children don't care for Sukhiram while Shyam is complete different from everyone Laxmi widowed sister of Sukhiram is taunted in her village for being a widow she suddenly inherits wealth and comes to stay with Sukhiram's family where everyone's nature changes towards her.Laxmi promises that if they respect Sukhiram she will distribute the wealth among them.She also changes Shyam's lifestyle whose not behind her wealth but lives loner life from his family.In reality Laxmi has lost all the accumulated wealth in settling debts and is only known to Sukhiram.,5,28,https://www.imdb.com/title/tt0419005/
Aakhri Daku,178172,1978,Action,NA,NA,Hindi,Randhir Kapoor,Vinod Khanna,Rekha,NA,NA,NA,"Mangal Singh played by Vinod Khanna is a dreaded dacoit of the Chambal valley who mercilessly loots people and kills them and has a reward of Rs. 5000 on his head which becomes Rs.50,000. His lady love is Champa, played by Reena Roy, who wants him to leave this life and get married to her. On the other side of the coin is Bhola, a village simpleton, extremely honest and religious, who is very poor and so is scolded by his mother played by Achala Sachdev. Taking offense he decides to end his life and in the process is caught by Mangal Singh's aides, who take him to Mangal Singh. When Mangal Singh comes to know that Bhola wanted to end his life due to poverty, he trades with him that as Mangal Singh's true identity is not known by the police, Bhola should become Mangal Singh, get caught deliberately and hang instead of him, whence the real Mangal Singh will collect the reward of Rs.50,000 from the government and give to Bhola's family. The course of events however reveal that Mangal Singh is in reality Bhola's true brother. Also Bhola's lady love, played by Rekha will not let him commit suicide and chides him for running after money. The police however have already recognized Bhola as dacoit Mangal Singh. Will Bhola's stance be vindicated and what will be the fate of the real dacoit Mangal Singh?",5.6,26,https://www.imdb.com/title/tt0178172/
Bhookamp,350613,1993,Action,Drama,Thriller,Hindi,Firoz Ali,Harbans Darshan M. Arora,Deven Bhojani,Haris Umar Khan,NA,NA,"Prof. Ajay Saxena is a common man with a strong streak of honesty, who arrives in the city of Mumbai and joins as a Psychology professor in a college run by Mahendra Khanna. He stays as a paying guest with Mrs. D'Sa whose son Johnny is an ideal student for him. One day Ajay berates a student Jagdish (aka Jaggi) for his unruly behavior, not knowing that Jaggi is the nephew of Ramniklal and Mahesh Shah, who control the drug trade in the city under the protection of a gangster Daya Patil. Jaggi takes his revenge by turning Johnny into a drug addict and getting him killed by a drug overdose. Then Mrs. D'Sa is murdered in the street by Daya Patil but due to no witnesses coming forward, Ajay is helpless. He loses his hope in the due process of law, though his ex-student Inspector Rahul Singh keeps assuring him to the contrary. Satyajeet Anand is an editor of a newspaper, ""The New Daily Times"", who is always hell-bent in exposing the criminals, dissuaded by his wife Pooja who fears their wrath. He helps Ajay in knowing who are the people who are corrupting the society, but is brutally murdered by them. Now Ajay cannot keep quiet anymore and decides to eliminate all anti-social elements from the society personally.",5,27,https://www.imdb.com/title/tt0350613/
Ameer Aadmi Gharib Aadmi,213449,1985,Drama,NA,NA,Hindi,Amitabh Bachchan,Zeenat Aman,Rabia Amin,NA,NA,NA,"Subhash Gaekwad is a worker employed in a mill run by Lal and partners. Lal does not pay his workers well, and they decide to go on an indefinite strike. Lal does not really care, and soon the strike turns ugly, with the police being involved. Subhash lives with his wife, and both have a small child. With no wages coming in, they are near destitution, and his wife takes to begging. One day, the leader of their union is mortally wounded, he approached Subhash and gives him a key, and then dies. Subhash comes to know that the key is of a locker, located in a Mosque. When he opens it, all he finds is an audio cassette, in which threats are made to kill the union leader, by Mill owner, Lal. Subhash puts this tape in a tape-recorder, and leaves it at a pawn shop. Lal and his men find out, and try to beat the truth out of Subhash, but Subhash does not tell them anything. They then have the police arrest him on false charges, and imprison him. Subhash's wife approachs Advocate Ashok Saxena, who takes the help of Akram to assist Subhash in prison, and to find out the truth, without knowing that Lal has also sent in his goon, to beat the truth out of Subhash. When Ashok finds out the truth, he confronts Lal, only to be told that Ashok's girlfriend, Kavita, is abducted and in their custody, and will be killed unless all information is turned over to him. Ashok does so, only to be himself entrapped, alongwith Kavita. And it is then that Ashok realizes that Lal will go to any extent to cover up his threats, even kill.",5.4,22,https://www.imdb.com/title/tt0213449/
Bharosa,56866,1963,Comedy,Drama,Romance,Hindi,Guru Dutt,Asha Parekh,Mehmood,NA,NA,NA,"Ramdas is a trusting individual, and trusts everybody around him. When times turn bad for him, he entrusts the life of his son, Bansi, to his trusted employee, Ronaklal, and departs. He regularly sends money to Ronaklal to provide for the upkeep of his son, but Ronaklal uses this money to educate his son, Deepak, keeps Bansi uneducated, and makes him do a lot of manual work. Years pass by, Ronaklal is now crippled, and is dependent on Bansi, as Deepak has left him, got married to a wealthy girl, and lives with his in-laws. Ronaklal is unable to show his face to Ramdas, and avoids him, and Bansi has grown up without knowing who his real father is. Will Ronaklal be able to tell Ramdas the truth when he returns, or will be just let Deepak be the sole heir to all the estate and the property?",6.1,34,https://www.imdb.com/title/tt0056866/
Jawab,139392,1970,Action,Drama,Romance,Hindi,Ashok Kumar,Meena Kumari,Jeetendra,Kumar,Kuppuswamy,Narayan,"Raja (Jeetendra) lives with his widowed sister Divya (Meena Kumari) in a small village. He is constantly being made a target by the oppressive local Zamindar and his two children, Sagar and Chanchal. The land owner's children decide to take revenge on Raja by getting Sagar married to Raja's sweetheart Neela. The Zamindar also molests Raja's sister, who kills herself. With his Neela married and his sister dead, a devastated Raja heads to the city. Once over there he attempts to put his life together, and try to forget the past. It is then he meets with another victim of the Zamindar, Bajrangi (Mehmood) and together they conceive a plan that will avenge them against their oppressors. The question is, will they succeed or will there be more victims.",5.2,29,https://www.imdb.com/title/tt0139392/
Payal Ki Jhankaar,156882,1980,Romance,NA,NA,Hindi,Alankar Joshi,Roobini,Surinder Kaur,NA,NA,NA,"Shyama is an orphaned young woman who lives with her aunt, uncle and several cousins, two of who are girls of marriageable age. Her passion is dancing, which is frowned upon by her uncle and aunt. One day she, along with a young man named Gopal, go to see the dance by an international artiste named Veena. They ask Veena and her mentor, Dinanath, for help but are shunned and asked to leave. Crestfallen, she returns home and sleeps outside the door as it was very late. The next day her aunt finds out about her overnight excursion and beats her up severely, followed by another beating by her uncle. Humiliated, she decides to run away with Gopal to another town in order to learn dancing at the hands of well-known Guru Kishinchand Sharma. They do find Kishin, who initially rejects them, but relents when he witnesses Shyama abilities. He decides to be her mentor and in this manner Shyama excels in her talents, so much so that she is asked to perform on stage in a competition with none other than Veena. The question remains, will Shyama succeed against an renowned international artiste such as Veena?",5.5,25,https://www.imdb.com/title/tt0156882/
Do Dilon Ki Dastaan,359167,1985,Romance,NA,NA,Hindi,Sanjay Dutt,Padmini Kolhapure,Shakti Kapoor,NA,NA,NA,"While multi-millionaire Mr. Saxena is busy announcing the engagement of Vijay, his grandson, he, himself, is busy driving a horse-carriage, and getting into fisticuffs with hoodlums. Vijay is quite unhappy with his grandpa about his engagement with Hong Kong returned Aarti Verma, the only daughter of wealthy magnate Roshanlal Verma. For Vijay is in love with an unknown young woman he saw at the airport. Unable to get her out of his mind, he is thrilled when he gets to meet her again in Srinagar and finally finds out that she is his tour guide, Sona Mathur. After a few misunderstandings, Sona too falls in love with him. Then things change unexpectedly after they meet with an accident, whereby Vijay temporarily loses the use of his legs. When he limps over to Sona's room, he is told that she has been discharged. And the person she has been discharged with is a young man by the name of Kamal - who is also in love with Sona. Vijay must now find out why Sona has deserted him, and if at all Kamal is the reason behind this desertion.",5.1,31,https://www.imdb.com/title/tt0359167/
Stuntman,6539830,2018,Documentary,NA,NA,English,Eddie Braun,Slash,Evel Knievel,NA,NA,NA,NA,6.9,259,https://www.imdb.com/title/tt6539830/
Shiv Ram,376884,1991,Action,Crime,Drama,Hindi,Jeetendra,Aditya Pancholi,Sadashiv Amrapurkar,NA,NA,NA,NA,4.3,26,https://www.imdb.com/title/tt0376884/
Insaaf Ki Awaaz,91267,1986,Action,Drama,NA,Hindi,Rekha,Anil Kapoor,Richa Sharma,NA,NA,NA,"Jhansi Rani is an honest police officer and her husband is an honest man who works in a factory. Mahendranath and Kailashnath are two wicked man. Jhansi Rani's brother Ravi loves Mahendranath's daughter, which he doesn't like. Chandra Shekhar is killed by these two wicked people and they play a cat and mouse game with Jhansi. The latter has to resign and now Ravi cries out revenge against them. Will he succeed ? Will the cry for justice be heard ?",4.8,36,https://www.imdb.com/title/tt0091267/
Aakhri Goli,75618,1977,Action,NA,NA,Hindi,Sunil Dutt,Leena Chandavarkar,Farida Jalal,NA,NA,NA,"The movie is theme based on revenge as the basic ingredient. Sunil Dutt's father and mother are killed in bus robbery.Sunil Dutt as small child remembers Amzad Khan's eyes.This is the key to start of revenge incident. In his adulthood, he vows to kill the villain with 5 bullets in his hand. He madly searches for them all night and day.Leena Chandawarkar played as female lover.The music number,""O DADDY JI BOLO MERA BETA JI"", is unique.",4.8,23,https://www.imdb.com/title/tt0075618/
Trishakti,410809,1999,Action,Crime,Drama,Hindi,Sadashiv Amrapurkar,Milind Gunaji,Jatin Kanakia,NA,NA,NA,"Rajeshwar Raja is the uncrowned don of of the criminal world in Bombay, India. Working under his directions are Hasan Lalla and Hamid Pathan. Then Hasan Lalla decides to separate, and forms his own gang, which does not auger well with Raja. Things get worse between the two, resulting in a gang war resulting in many casualties on both sides, with the police stepping in and taking advantage of this situation. Then one day while Hamid is being attacked by Hasan's men, three men, Bajrang, Sagar Malhotra, and Mahesh alias Munnabhai, come to his rescue, & ensure that he is admitted in hospital for his injuries. A grateful Raja recruits the three in his gang, and asks them to attempt to bring Hasan down, which they agree to do. When the underworld finds out about the daring deeds of these three, and the manner in which Hasan has been subdued and forced to retreat, they start believing that Raja is no longer in control, resulting in Raja feeling threatened, and deciding to end his relationship with these three. He plots to creates misunderstandings, and enlists a devious scheme in which Mahesh and Sagar are arrested by the police, and Bajrang becomes the one who is responsible. A visibly upset Bajrang tries to clarify things to his two friends, but to no avail. It looks like Raja has once again succeeded in his overtures to be the sole and unchallenged don of the criminal underworld.",4.3,22,https://www.imdb.com/title/tt0410809/
Dilbar,346870,1994,Drama,Romance,NA,Hindi,Mamta Kulkarni,Rishikesh Raj,Nawaz Khan,Mohammed Kasim,NA,NA,"Priya Verma is a beautiful young woman who studies in N.M. College in Bombay. One day some fellow collegians on motorcycles surround her and start to molest her, until Ravi comes to her rescue. Both of them fall in love and would like to marry each other. Priya introduces Ravi to her Police Inspector brother, Sridhar Verma, but Sridhar dislikes Ravi and does not want Priya to meet him again, but Priya is adamant and insists on meeting and marrying Ravi until Sridhar threatens to kill himself. Priya promises to forget Ravi and agrees to marry whoever Sridhar chooses for her. And Sridhar has chosen a young man named Vishal, the only son of multi-millionaire Chandrachur. To her horror, Priya finds out that Sridhar has chosen Vishal not because he approves of him, but has a devious plan to avenge the death of his governess Kalavati Verma at the hands of Chandrachur. The question is will Priya be the right person to help Sridhar avenge Kalavati's death?",4,28,https://www.imdb.com/title/tt0346870/
Laat Saab,104660,1992,Action,Crime,Drama,Hindi,Ishrat Ali,Asrani,Sharokh Bharucha,NA,NA,NA,"Born on the 17th of September in Uttar Pradesh, Vijay Rai leads a wealthy lifestyle along with his dad, Ajay Kumar, who are now settled in scenic Simla. Since Vijay is 25 years old, his dad wants him to get married, but Vijay wants to find his own soul mate. He does find her in Bombay-based Anju, both meet and fall in love with each other. When Anju is informed that her dad is ill, she returns home, and leaves a note for Vijay to contact her there. Upon receiving her note, Vijay departs for Bombay and reaches Anju's residence. He is received by her dad, Dinanath, who informs him that Anju has been dead for over 3 years now. A disbelieving Vijay, assisted by CBI Inspector Jayant Mathur, decides to trace Anju. He and Jayant do find her, but she claims that she has never met Vijay and identifies herself as Mona, a Goa-based dancer/singer. Vijay must now accept Anju's death and move on little knowing that if he persists he will soon be declared insane as none of the people he has come across thus far are who they claim to be.",3.2,28,https://www.imdb.com/title/tt0104660/
Dand Nayak,446118,1998,Action,NA,NA,Hindi,Arjun,Arun Bakshi,Arun Bali,NA,NA,NA,"Bankhelal Chaurasia came to Bombay from Uttar Pradesh, and started his business of raising and keeping buffalos, and selling milk. At first he got into petty crimes, but soon graduated to major crimes, and got a reputation and big name for himself in the Bombay underworld. He fears only person, and that is Inspector Vishal of the Bombay Police. Vishal has sworn to apprehend Bankhelal by hook or by crook, and he has a reputation of doing this - no matter what the consequence.",3.7,29,https://www.imdb.com/title/tt0446118/
Marmayogi,260168,1951,Thriller,NA,NA,Tamil,Pandari Bai,Anjali Devi,Madhuri Devi,NA,NA,NA,"Urvasi (Anjali Devi), is the young mistress of a king (Serukalathur Sama). With the help of her own lover (S. A. Natarajan), she pushes the king off a boat and usurps his powers. Urvasi appoints herself as the new queen regnant, and the kingdom experiences a reign of terror. The palace where the two princes of the kingdom live is burnt. The queen assumes all powers and kills all potential opponents, including her lover. A sage comes to the kingdom with his son and a girl, and joins the queen as her adviser. Years roll by. The sage's son Veerangan (S. V. Sahasranamam) is appointed Army Commander. At the same time, in the countryside, Karikalan (M. G. Ramachandran) functions as de facto leader of the people, helps them in various ways and fights the queen's misrule. When he becomes a big threat to the queen, she orders his capture. Veerangan sends Kala (Madhuri Devi), the girl raised by the sage as a spy, to Karikalan, but she falls in love with him. Karikalan gets periodic instructions from the Goddess on what needs to be done and he follows the same. The queen gets scared by a ghost which appears regularly and warns her of the impending punishment she deserves for her misdeeds. Kala and Karikalan's followers are captured by the army. Karikalan personally leads their rescue mission. In prison, he gets instructions from the goddess to capture the queen also. He rescues his people, captures the queen and brings her to his hideout. When the ghost appears there, she confesses her crime of killing the king. When she is about to be executed, Veerangan's army enters and captures everyone. Veerangan also finds out that the sage (also called Marmayogi) is his father, and he has been giving information to Karikalan secretly. Hence he also gets arrested for being a traitor.[1] The queen returns to her throne and orders the execution of the sage, Karikalan and others. When Karikalan is about to be killed, the sage reveals the truth about the king and informs Veerangan that Karikalan is his elder brother. When Veerangan demands to know where the king is, the sage removes his disguise. To the surprise of everyone, he reveals that he is the deposed king and narrates what happened. Though the queen and her lover attempted to kill him, he escaped under the water using his yogic skills, taking his sons and the army commander's daughter Kala with him. He returned to his kingdom in the disguise of a sage with his younger son Veeranganan and Kala and left Karikalan in the forest. Shocked to see the dead king return, the queen dies. The king announce that his children Karikalan and Veerangan are now the rulers.[2]",7.4,20,https://www.imdb.com/title/tt0260168/
Dil Toh Deewana Hai,5784778,2016,Drama,Romance,NA,Hindi,Zeenat Aman,Raj Babbar,Meenu Bhardwaj,NA,NA,NA,"Raja(Haider Khan) is a guy who has always remained a 'good friend' to most of the girls, that is if they have not already beaten him up! He has always been shy, never to open his heart out. Raja meets the girl of his dreams Anamika(Sada) in tube in Malaysia. She is a spoilt, arrogant daughter of a billionaire in Malaysia. As days pass, Raja gets more and more hooked on to her and expresses his feelings to her. This is when his life takes a different turn and he is left on the thresholds of life",6.5,21,https://www.imdb.com/title/tt5784778/
Ratnadeep,156940,1951,Drama,Romance,NA,Hindi,Abhi Bhattacharya,Chhayadevi,Manju Dey,NA,NA,NA,NA,6.6,12,https://www.imdb.com/title/tt0156940/
Do Musafir,214635,1978,Drama,Family,Romance,Hindi,Shashi Kapoor,Rekha,Ashok Kumar,NA,NA,NA,NA,7.1,26,https://www.imdb.com/title/tt0214635/
Mama Bhanja,357890,1977,Comedy,Drama,Family,Hindi,Shammi Kapoor,Randhir Kapoor,Parveen Babi,NA,NA,NA,A dying mother leaves her orphan son to her only brother who brings up his nephew with love and care. The nephew grows up with a lot of values. One day the Uncle strikes it rich and is then hounded by a woman who seduces him for his money. This is see by the nephew but the Uncle does not understand. Now starts the job of the nephew to get this woman out of his uncles's life and show his uncle what she really is.,6.6,34,https://www.imdb.com/title/tt0357890/
