Title,IMDB ID,Date of release,Genre1,Genre2,Genre3,Language,Actor1,Actor2,Actor3,Crew1,Crew2,Crew3,Plot summary,IMDB rating,IMDB votes,IMDB URL
Karan,448586,1994,Action,NA,NA,Hindi,Virender Razdan,Aparajita,Sulabha Arya,NA,NA,NA,"Karan lives with his widowed mother Mrs Dewan who runs Karan Motel he meets Natasha in college and both fall in love but Jaggi son of politician Ramprasad Jwala tries to woo her and has tiff with Karan.Jwala plans to get Natasha and Jaggi married by calling of the strike in factory of Pawan Puri father of Natasha.But Natasha is not interested in getting married to Jaggi,soon Mrs Dewan is held for running drugs business in her hotel she commits suicide to escape the shame.Jwala was mastermind behind everything and got Mrs Dewan killed by Jaggi and Billa and forced her to sign transfer of Motel in name of his partner Lalwani.Karan attacks Lalwani when he tries to take the Motel and gets jailed for the same where as Pawan Puri wants Natasha to close all ties from Karan.When Karan gets bail his lawyer also brings stay order on Motel so Lalwani cant take the control ,Karan now plans for revenge as who framed is mother but still unaware that she was killed and didn't commit suicide.",4,28,https://www.imdb.com/title/tt0448586/
Aaj Ka Andha Kanoon,426863,2003,Action,NA,NA,Hindi,Sudesh Berry,Priyanka Upendra,Aman Jalali,NA,NA,NA,Deva comes to the city in search of work! He meets with Shiva who is a smuggler and working illegally. Deva tells Shiva that he is not happy with this and the both of them fight. Shiva is killed by Deva and at that moment the police arrive to arrest him. The police inspector advises Deva that he did a good thing by getting rid of Shiva and that he should become the 'Robin Hood' to help other people of the city. Deva agrees but the greed gets to him and he is pursued by the inspector now. How will the chase go? Will he catch up with Deva? Will justice prevail?,3.1,19,https://www.imdb.com/title/tt0426863/
Garam Coat,325447,1955,Drama,NA,NA,Hindi,Nirupa Roy,Jayant,Rashid Khan,NA,NA,NA,"Girdharilal lives a poor lifestyle in Delhi along with his wife, Geeta, and two daughters and a son. He works as a Money Order Clerk in the Post Office, earns Rs.110/- per Mensem, and wears a torn coat that his wife is tired of stitching. One day at work, he makes an error in a money order but does manage to fix it, collects his pay and returns home, refusing to drink alcohol with his co-workers, Sher Khan and Munnilal. He then sets out to buy some snacks and toys for his children and loses a 100 Rupee note. Unable to recollect where he lost it, he decides to kill himself but when he misses the train he returns home and confides in his wife. She assures him that she will manage somehow. He manages to borrow money, even finds a part-time job, to pay off his bills, but is unable to pay his electricity bill. One night he returns home and finds the pantry full. His mind distracted with doubts about his wife's character, he starts making mistakes at both his places of employment, and returns home to find his door locked, his wife missing, and his children playing outside. When he questions them about the whereabouts of their mother, they refuse to tell him. Shortly thereafter Sher Khan and Munnilal, concerned about their co-worker, find him near the railway tracks heading straight into an on-coming train. Sher manages to rescue him, and this is when he will tell them the devastating news that Geeta has taken to prostitution and he has killed her. Watch what impact this has on his employment, his children, and his friends.",7.3,19,https://www.imdb.com/title/tt0325447/
Choron Ki Baaraat,237098,1980,Action,NA,NA,Hindi,Shatrughan Sinha,Neetu Singh,Ajit,NA,NA,NA,"Anju lives a wealthy lifestyle with her widowed dad, Dhanraj, on a privately owned island. She studies in a hostel, plays on the football team, but is known for getting into fights with other girls, rather then taking part in this sport. She meets with a young man, Shekhar, and both fall in love with each other, so much so that she invites him to work on her dad's island. Her dad employs Shekhar and hopes to get his daughter married to him. But before that could happen, six men men who had duped by Dhanraj several years ago, arrive on the island incognito, enlist the assistance of the island's native people, led by Heera, who have been oppressed by Dhanraj and Captain Ashok, to recover their loot and kill Dhanraj and Anju. It is here that Anju will find out that the reason Shekhar accompanied her was not because he loves her, but for quite some other unknown and devious reason.",7.1,22,https://www.imdb.com/title/tt0237098/
Amanat,47816,1955,Drama,Family,NA,Hindi,Bharat Bhushan,Chand Usmani,Nasir Hussain,NA,NA,NA,"A dying man entrusts his lives earnings to Purshotam, a stranger he just met, and asks him to promise to take this money to his wife, and son, Pradeep, in a remote village in India, to which Purshotam agrees. The man passes away, and Purshotam goes to fulfill his promise, in vain though, as he is unable to trace the woman and her son. After sometime he experiences financial difficluties, and decides to use the money for his personal gain. Years later he comes to know of the rightful heir to these monies, but will he able to assert his honesty, or will he carry on as though nothing has happened?",7.1,20,https://www.imdb.com/title/tt0047816/
Suvarna Sundari,7822474,2019,Action,Thriller,NA,Telugu,Shamna Kasim,Sakshi Chaudhary,Jaya Prada,NA,NA,NA,"The movie revolves around an idol, Suvarna Sundari and the effects of it. The idol, also known as Trinetri, dates back to 15th century. Whoever possesses the idol, becomes a victim of destruction because of the history the idol has. On the other hand, a gang desperately seeks the idol as it can fetch them a lot of money in the international market. They also believe that possessing the idol brings people good luck. An archaeologist, played by Jaya Prada, knows the history of Suvarna Sundari and vows to prevent the damage it causes to people. Meanwhile, a couple - Anjali and Ram - visit a company to strike a deal, but they get stuck in a lift along with five different people. What follows next is a series of deaths, that adds to the mystery. Will the archaeologist succeed in her mission?",3.6,4586,https://www.imdb.com/title/tt7822474/
Sheesh Mahal,243555,1950,Drama,NA,NA,Hindi,Sohrab Modi,Naseem Banu,Pushpa Hans,NA,NA,NA,"Thakur Jaspal Singh lives in the prestigious and palatial house called the Sheesh Mahal. He is badly in debt, yet continues to live a lifestyle far over and above his means. His son and two daughters are concerned, and try to stop him from over-spending, but he disregards them. Then one day the inevitable happens, and Jaspal Singh has to leave Sheesh Mahal, which must now be sold by auction to pay off his debts. Jaspal and his children move into a small room in the nearby slums, where they hope to spend the rest of their lives. Jaspal's son finds employment in a mill, but unfortunately meets with an accident, and in order to save his life, the doctors amputate his leg, leaving his unemployed and dependent. Jaspal's daughter, Ranjana, attempts to secure employment, but proud Jaspal will not hear of this. Ranjana gets employment, but she does not tell her father about it. Ranjana meets with a young man and both fall in love with each other. When this young man's father, Durgaprasad, comes to ask Jaspal for Ranjana's hand, Jaspal finds out that he is the new owner of Sheesh Mahal, and that Ranjana has been working as a maid there. Jaspal is furious, and taking his sword, he rushes over to the Sheesh Mahal with a clear intend of killing Ranjana, and anyone else who dares to stop him.",7.4,21,https://www.imdb.com/title/tt0243555/
Shaheed-E-Azam,4063584,2002,Biography,Drama,History,Hindi,Sonu Sood,Manav Vij,Binnu Dhillon,NA,NA,NA,"The film, based upon the life of Shaheed Bhagat Singh, caused some controversy as the Punjab and Haryana High Court issued a notice to the producers calling for a ban of the movie.It was released in 2002. In the same year two other movies on Bhagat Singh were also released named '23d march 1931 Shaheed' and 'The Legend of Bhagat Singh'.",6.8,30,https://www.imdb.com/title/tt4063584/
Doosri Dulhan,361532,1983,Drama,Family,NA,Hindi,Victor Banerjee,Sharmila Tagore,Shabana Azmi,NA,NA,NA,NA,6.8,19,https://www.imdb.com/title/tt0361532/
Aaja Sanam,482671,1994,Drama,Romance,NA,Hindi,Mohnish Bahl,Chandni,Kulbhushan Kharbanda,Rangarao Chougule,NA,NA,NA,3.3,8,https://www.imdb.com/title/tt0482671/
Ek Baar Chale Aao,340090,1983,Drama,NA,NA,Hindi,Asrani,Bharat Bhushan,Jankidas,NA,NA,NA,"Dharam Das has found an ideal groom for his sister in Din Dayal, who agrees to wed her. However, on the day of the wedding, Din demands an exorbitant amount of dowry, and when Dharam is unable to come up with it, breaks off all ties, returns home, and gets married to another woman. This leaves the Das family completely devastated, the to-be bride kills herself, and the shock of her death kills her father, and Dharam swears to avenge this humiliation at all and any costs. Years later Din has a daughter by the name of Gulab, who is in love with Kamal, the son of Dharam. When Dharam finds out, he is enraged and refuses to permit Kamal to get married to her, but when Kamal insists, Dharam reconsiders and permits the marriage to take place. After the marriage, Gulab is found in the bridal chamber with another man, Ravi; while Kamal is nowhere to be found. The next day Dharam takes Gulab back to Din's house and demands that he be paid 25 Lakhs as dowry. A bewildered Din, who had put all this in the past, is unable to come up with the money, but agrees to keep Gulab with him, get her divorced and re-married to Madan Lal. The question remains where was Kamal on the night of his marriage, and was he also involved in this plot to humiliate Din?",6.4,16,https://www.imdb.com/title/tt0340090/
Ek Chitthi Pyar Bhari,408734,1985,Drama,NA,NA,Hindi,Raj Babbar,Reena Roy,Agha,NA,NA,NA,"Dr. Sunil Sharma runs two clinics in rural India - mainly for the benefit of poor and needy people. He advertises in the newspapers for a qualified nurse, who must be single, and be willing to work long hours. A young and attractive woman named Aarti Saxena responds to his advertisement, is successful in the interview, and gets hired. Sunil finds himself getting attracted to Aarti, and mentions about her to his mother. His mother visits the clinic and approves of Aarti. She would like Aarti and Sunil to marry as quickly as possible. What Sunil and his mother do not know that Aarti has a sordid past - she has been disbarred from the nursing profession; she is married, and has a child by the name of Bulbul; and had assaulted a patient named Kamal Nath, when he expressed dissatisfaction with her work. Will Aarti be honest enough to tell Sunil about her past - or will she just refuse to marry him.",6.6,17,https://www.imdb.com/title/tt0408734/
Kundan,364466,1993,Action,Drama,NA,Hindi,Dharmendra,Jaya Prada,Amrish Puri,NA,NA,NA,"Thakur Shamsher Singh lives a wealthy life that is funded chiefly by criminal activities such smuggling and dealing in drugs. He has never been arrested as he has several high-ranking politicians and Police Officials on his 'payroll'. When an Editor of a newspaper exposes him, he has the entire family ruthlessly killed. When he finds out that Superintendent of Police Kundan Singh has been transferred from Delhi especially to apprehend him, he initially befriends him, but when he finds out that Kundan cannot be brought, he concocts a devious plot that will ensnare Kundan, his wife, Parvat, pet dog and monkey - so that he can continue to remain the uncrowned king of the underworld.",5.8,45,https://www.imdb.com/title/tt0364466/
J.D.,5463608,2017,Drama,NA,NA,Hindi,Rina Charaniya,Arvind Gaur,Jaswir Kaur,NA,NA,NA,"The Media brings news every moment from all over the world, but what happens within the Media is not known to the world. JD is the'Breaking News' from inside the Media. The Journalists who fight for Truth and Values are very helpless in fighting for their own rights. The power of Media is captive in the hand of a few people and they wear different masks. Every powerful Establishment first tries to scare, then allures and finally crushes in a maze of defamatory conspiracies. The one who rises with a steely resolve from this fall becomes JD. This is the story of Jai Dwivedi alias JD. He had started his journalism from Lucknow but Delhi was in his dreams. His pen had the power to shake the seat of power. Will he confront the powers of Media and Politics, or he will shake hands with them?",5.3,19,https://www.imdb.com/title/tt5463608/
Kahin Hai Mera Pyar,3585758,2014,Drama,Musical,Romance,Hindi,Eesha Agarwal,Gajendra Chauhan,Sanjay Kapoor,NA,NA,NA,"Every youth's imagination of love that relates the story of Adam & Eve, known since ages and shot very first time in Hindi Language in India. Natures own creation Adam and Eve believed to be in heaven, were incited by a python to eat a fruit. Eve ate the fruit and then fed it to Adam. They were forbidden to have it and on eating it were exiled from Heaven. A painter, Karan, who is getting blur images of a girl is trying to produce it on canvas, he writes at the bottom of all the portraits 'Kahin Hai Mera Pyar' as a sign of his belief that his love exists somewhere! A businessman buys all portraits this provokes Karan's feeling and he opts to search for his love more vigorously as the story unfolds further.",5.7,20,https://www.imdb.com/title/tt3585758/
Ek Phool Teen Kante,251068,1997,Comedy,NA,NA,Hindi,Vikas Bhalla,Monica Bedi,Sadashiv Amrapurkar,NA,NA,NA,NA,5.9,18,https://www.imdb.com/title/tt0251068/
Nasbandi,232164,1978,Comedy,Drama,NA,Hindi,Anitav Bachchan,Kanauj Kumar,Shahi Kapoor,Jagdish Gaidole,NA,NA,"Inder Sen Johar's much publicized comic look at the forcible sterilization program carried out under the orders of former Indian Prime Minsiter, Indira Gandhi, and her son, Sanjay Gandhi, during the dark days of Emergency. Johar comically portrays this story, which was censored and banned for several years by the Government of India, and stars duplicates of many popular Bollywood stars, including Anitav Bachchan. Songs (which continue to be banned by the Indian Government) are hilarious too: ""Kiski chali hai kahe gaye baat ye pyare Jhulelalan, jaan bachao, kher manoa, lagega sub ka number, dhama dham mast kalandhar, aaj hai koi baher to kal woh hoga andhar...""; ""Prabhuji de do ik santann....""; ""Kya mil gaya Bhagwan, Emergency lagake nasbandi karake hamari chuthi karake, nasbandi karake hamari bansi bajake..."".",6.5,19,https://www.imdb.com/title/tt0232164/
Raj Hath,129331,1956,Adventure,Drama,Romance,Hindi,Madhubala,Pradeep Kumar,Ulhas,NA,NA,NA,"Maharaja Daljit of Jagmere is displeased after his envoy, Rana Sangram Singh, is humiliated by Maharaj Baktawar of Satnapur who rejects the marriage proposal of the former's daughter with his son. Enraged, he instructs everyone in his region to stop all celebrations and prepare for war, while Baktawar is certain that victory is within reach as no one can penetrate the labyrinth that surrounds his kingdom. Then the Rajkumari herself dons the guise of a dancer/singer, manages to find her way around the labyrinth and returns home with the map. Daljit prepares to seek the blessings of Bhagwan Shri Shankar and plans to attack Satnapur after a week on a Tuesday - little knowing that nothing is going to go his way.",6.5,22,https://www.imdb.com/title/tt0129331/
Dooriyaan,156485,1979,Drama,Family,NA,Hindi,Uttam Kumar,Sharmila Tagore,Shreeram Lagoo,NA,NA,NA,"Uttam Kumar and Sharmila Tagore were very much in love with each other during their courtship days. After their marriage, they have a child too. But their personal ambitions take their lives in different directions, the child is torn apart between the feuding parents who finally separate, only to realize in the end that their dreams and personal ambitions are futile if they cannot keep peace within themselves.",6.2,23,https://www.imdb.com/title/tt0156485/
Beqasoor,128962,1950,Drama,NA,NA,Hindi,Madhubala,Ajit,Pramila,NA,NA,NA,"A young, simple girl is caught in the cross-fire of a deep-rooted sibling rivalry between her upright husband and her scheming brother-in-law. The brother-in-law exploits the girl's naivet and trusting nature to falsely implicate her husband in a corruption case, and turns husband against wife by wrongly vilifying her character.",6.8,22,https://www.imdb.com/title/tt0128962/
Begunaah,1692184,1991,Action,Crime,Drama,Hindi,Rajesh Khanna,Ashok Kumar,Farha Naaz,NA,NA,NA,"Widower Jeevanlal gets arrested for assaulting a Pharmacist as he is unable to afford medicines to treat his ill daughter, Guddu. Subsequently jailed, his repeated and vain attempts to escape only end up increasing his sentence, leaving Guddu to fend on her own. Years later he will re-surface as a wealthy male and prospective Mayor known simply as J.V.; while Guddu will be living two lives - one as the single mother of a young child, Kiran; and the other as a gun-toting alcoholic prostitute known as Bulbul.",5.4,20,https://www.imdb.com/title/tt1692184/
Pyaar Diwana,176072,1972,Comedy,NA,NA,Hindi,Kishore Kumar,Mumtaz,Padma Khanna,NA,NA,NA,"Sunil is a collegian and comes from an upper class family. His parents want him to marry the girl of their choice, but he rebels, and refuses to do so. He wants to marry beautiful fellow collegian, Mamta. But will his parents let him have his own way?",5.9,18,https://www.imdb.com/title/tt0176072/
Infinitum: Subject Unknown,12108622,2021,Mystery,Sci-Fi,NA,English,Tori Butler-Hart,Ian McKellen,Conleth Hill,NA,NA,NA,"Shot on an iPhone with a remote crew during the first lockdown in London, Infinitum Subject Unknown is a mind-bending slice of British science fiction. Jane (Tori Butler-Hart) wakes up in a strange attic, bound and tied to a chair, she has no idea where she is or who she is. As panic sets in, she sees a violent bright light flash in front of her eyes and once again she wakes up; same situation as before, an exact repeat. Voices bleed in from another time and place, giving Jane clues to what might be happening to her. She escapes and embarks on a journey through an empty parallel world leading her to a Quantum science research laboratory in the middle of nowhere. There she discovers tapes from Dr Charles Marland-White (Ian McKellen) and Professor Aaron Ostergaard (Conleth Hill) and their experiment involving human test subjects.",5.7,6325,https://www.imdb.com/title/tt12108622/
Sabse Bada Sukh,69204,1972,Comedy,Drama,NA,Hindi,Vijay Arora,Asrani,Rajni Bala,NA,NA,NA,"Village born Lalloo re-locates to Bombay, and returns a wealthy man. He goes to meet his friend, Shankar alias Bhompu, and together they meet and share tales, mostly about women, sex, and playboy magazines' pictures. A Bollywood movie director is shooting a film nearby, and they go and meet him and his beautiful actress, Urvashi. After meeting Urvashi, Shankar feigns a racking cough, and tells his family that he must go to Bombay, and seek medical treatment. Together he and Lalloo take the next train to Bombay to see if they can find the biggest happiness in life.",6.1,18,https://www.imdb.com/title/tt0069204/
Phool Bane Angaare,362023,1963,Drama,Romance,NA,Hindi,Mala Sinha,Raaj Kumar,Ashish Kumar,NA,NA,NA,"Based in Santa Cruz, Bombay, Usha undertakes to look after her family consisting of her widowed mother and younger brother, Ashish, and even decides to not marry her army officer sweetheart, Captain Rajesh, so that she can look after them. Rajesh is called to the front in Korea, her mom passes away, and she brings up Ashish on her own. Years later, Rajesh has still not returned, Ashish gets married to Kamla, much to Usha's chagrin. Shortly after the marriage, Kamla humiliates Usha and she decides to leave. The question remains where will a lone woman re-locate, and what prevented Ashish from coming to her assistance.",6.1,21,https://www.imdb.com/title/tt0362023/
Jai Shiv Shankar,384220,1990,Drama,NA,NA,Hindi,Rajesh Khanna,Jeetendra,Dimple Kapadia,NA,NA,NA,"This is a story of three men first one is Jai frank and fearless journalist and crusader, for whom the most dangerous of swords, guns, or bombs are no match. He may lay down his life, but will not compromise with the ultimate truth. The second one is Shiv a violent angry man, who has been branded by the society as an anti-social element but is, in fact, a victim of the circumstances in his life. There is a silver streak beneath his terrorism exterior and his lifestyle is a phenomenon by itself. And the third one is Shanker, who has been directed into forbidden paths of life by those elements who are a curse of the society, for furthering their own interest. However when he realizes his mistake, he takes them on, one after another, and exposes them in public. And when these three youths Jai, Shiv, Shankar join hands and launch a tirade against evil, the murky world of sin, tyranny and oppression shudders, and the society looks up to the new awakening. There is also an honest and upright Government officer Pooja, who succumbs to the pressure of red-tap ism in bureaucracy. Then there is Priya, who is the gift to future of health society. ""Jai, Shiv, Shankar"" is thus a clash of ideals, between the perpetrator of oppression and the upholders of truth.",5.2,24,https://www.imdb.com/title/tt0384220/
Shehnai,246923,1964,Musical,Romance,NA,Hindi,Biswajit Chatterjee,Rajshree,Nirupa Roy,NA,NA,NA,"Story of Military commitment by a military wife, Shobha (Calcutta, 1942) played by Nirupa Roy, who in spite of losing her husband to the Air Force and World War 2, despite hardships, carrying the family legacy forward, educates her only son Deepak (played by Biswajeet) to join the Air Force. Deepak also shows firm commitment to his vocation and legacy when forced into taking a decision to choose between his lady love, Preeti (played by Rajshree) and his Air Force Service, by Preeti's parents who fear that Air Force service will endanger his life. Preeti too, opts to serve the Red Cross so that she could be with Deepak.",5.7,20,https://www.imdb.com/title/tt0246923/
Bheegi Palkein,242311,1982,Romance,NA,NA,Hindi,Raj Babbar,Smita Patil,Dina Pathak,NA,NA,NA,"Ishwar Acharya lives a wealthy lifestyle with his widowed mom, a sister, brother Kishan and his wife, Janki; and another brother, Prakash who is also married. Janki would like Ishwar to get married to her cousin, but Ishwar loves his childhood sweetheart, Shanti, and wants to marry her. When he is unable to convince his mom and Janki to chance their minds, he marries Shanti at the Registrar's office and brings her home, where they are not welcome and they leave. Ishwar gets a job as an Insurance Investigator, Shanti gets pregnant and gives birth to a boy. Ishwar, who has always lived a wealthy life is unable to adjust to their modest incomes, and becomes angry and bitter. He gets into an accident and is hospitalized for several months. When he is discharged he is shocked to find out that his child has passed away. He physically abuses Shanti and yells at Chachi, who was looking after the ailing child. When Shanti returns home the next day, she finds that Ishwar has left her and gone to his mom's house. With nothing to connect them to their present lives, it looks like this marriage has come to an end, and the couple, who were once so very deeply in love, may never get to see each other again.",6.4,27,https://www.imdb.com/title/tt0242311/
Ladki,259390,1953,Comedy,NA,NA,Hindi,Vyjayanthimala,Anjali Devi,Bharat Bhushan,M. Alagappan,S. Arumuga Asari,S. Palani,"Raja lives a wealthy lifestyle with his somewhat upper Caste Hindu, eccentric, woman-hating dad, Hazurdas, and mom. He is friendly with Kishore, and both are aspiring doctors. On their way to college, they meet with two young women, Rani Mehra and Kamini. Both young men fall in love with them, with Raja taking the first initiative and getting married to Kamini, even though she of a lower untouchable Caste, but decides not to tell his parents. When he does inform them, they want him to divorce Kamini and get married to a girl of their choice, Raja refuses and returns back to Kamini, only to find her in the arms of her childhood friend, Sunder. Angered and hurt at this betrayal, he decides to marry the girl his parents have chosen for him - and he is due for another surprise - as the girl he is about to wed is none other than Kamini's friend, Rani. Watch what happens when a liberated, tom-boyish Rani finds out that Raja is already married, and the impact this has on everyone concerned.",5.9,24,https://www.imdb.com/title/tt0259390/
