Title,IMDB ID,Date of release,Genre1,Genre2,Genre3,Language,Actor1,Actor2,Actor3,Crew1,Crew2,Crew3,Plot summary,IMDB rating,IMDB votes,IMDB URL
Bindya,233345,1960,Drama,NA,NA,Hindi,Padmini,Balraj Sahni,Jagdeep,S. Arumuga Asari,V. Nagan Asari,N. Mohanraj,"After the passing of their parents, Devraj lives with his much younger brother, Ramu, in a small town in India. He gets married to Bindya, who moves in along with her mom, and brother, Raju. Devraj, who works with Rai Saheb Kedarnath, gets a promotion as a Government Contractor, and they move into a bigger house. Years later, Raju and Ramu have grown up, and Bindya's mom has passed on. While Raju has taken to petty crime and bad company, Ramu is more focused on his studies and has good sober habits. Devraj would like Raju to get married to Rama, Kedarnath's daughter, but he subsequently finds out that she has fallen in love with Ramu. This news is met with anger by Raju, who swears to avenge this humiliation. Devraj's step-mother, Mrs. Ramnath, and her daughter, Nandini, move in with them - thus ending their idyllic lifestyle - with Devraj suspecting Bindya of having an affair with their cook, Chandan, and Bindya thinking that Devraj is having an affair with Nandini. Things get bad to worse, when Ramu is accused of stealing a diamond ring from Kedarnath's house, and the Police being summoned. Questions that remain unanswered are: Are Devraj and Bindya really having affairs with Nandini and Chandan respectively, and why would Ramu steal from his prospective father-in-law's house?",5.7,19,https://www.imdb.com/title/tt0233345/
Raftaar,431350,1975,Drama,NA,NA,Hindi,Moushumi Chatterjee,Vinod Mehra,Danny Denzongpa,NA,NA,NA,"City-based Vikram is hired as a Manager by Kumar, a wealthy businessman, and asked to report for duty to a distant town in rural India. Vikram arrives there and carries out his duties. He meets with pretty village belle Rani, and both fall in love with each other. When Kumar arrives for an inspection, he finds everything satisfactory, and asks Vikram to run an errand for him out of town. A few days later, Kumar comes to know that Vikram has been arrested by the police, found guilty by the courts, and sentenced to a year in jail. A year later when Vikram is released he finds that Rani is missing, and believed to be dead. A devastated Vikram attempts to try and put his life together when some hoodlums attack him - with a view to kill him. Vikram escapes, but is seriously wounded, and is looked after by a band of gypsies. After Vikram recovers, he re-locates to the city together with a woman named Radha and her child, in order to help her find her missing husband. It is then he comes across Rani and Kumar. But this time Rani claims that she is Rita, and has nothing to do with him. Vikram must now get to the bottom of this mystery and find out if Rani really is deceased, and if not, then who exactly is Rita, and what is her relationship with Kumar?",6.1,14,https://www.imdb.com/title/tt0431350/
Char Paise,377632,1955,Action,Crime,Drama,Hindi,Shyama,Kishore Kumar,Agha,NA,NA,NA,"While in Delhi, plain-clothed C.I.D. Inspector Mohan meets with a gangster, Chandermohan, who is masquerading as a businessman, and agrees to meet with him in Bombay to do business together. After the later arrives in Bombay, he meets with a petty con-man, Basu, as well as his associate, Dasu, and the trio decide to ensnare Mohan in a fake business deal. Mohan, who lives with is widowed mother and a younger brother, Ashok, and is in love with Seema Baxi, has, in the meantime taken adequate measures to try and apprehend Chandermohan. But things do not go exactly as planned after Ashok gets abducted and Seema is determined to marry a male named Roshan.",5.6,18,https://www.imdb.com/title/tt0377632/
Maha Shaktishaali,440604,1994,Action,Drama,Thriller,Hindi,Pankaj Berry,Dharmendra,Gulshan Grover,NA,NA,NA,NA,5.3,18,https://www.imdb.com/title/tt0440604/
Vaade Iraade,363170,1994,Drama,Family,Romance,Hindi,Ayush Pandey,Mamta Kulkarni,Suchitra Krishnamoorthi,Tapan Bose,NA,NA,"Science College Principal Tripathi is critized by the college professors during a meeting due to his younger brother, Ajay, failing twice and losing two years. Tripathi is angry with Ajay and wants him to drop poetry and poems and concentrate on his studies. Ajay does not do so, and instead leaves the house, telling his brother that he will establish himself as a poet and then return home. He submits his poems for publication, and is told that there is something lacking in them. He meets with an falls in love with beautiful Nikita, who is only daughter of a wealthy industrialist. Ajay wants to establish himself before he gets married, and relocates to Bombay. Once there, he gets involved with a Bollywood actress, Jyoti, and takes to gambling and drinking. His submitted poems are stolen by a couple of shady men, who rake in a lot of money, leaving Ajay with a mere pittance. Nikita goes to Bombay and finds Ajay, a wasted young man, very different from the one she had seen earlier. Together they must try and put his life together, so that he can keep his promise to his brother.",4.8,21,https://www.imdb.com/title/tt0363170/
Miss India Canada 1991,399358,1991,Drama,Family,Romance,English,NA,NA,NA,NA,NA,NA,NA,NA,NA,https://www.imdb.com/title/tt0399358/
Nafrat,374079,1973,Romance,NA,NA,Hindi,Rakesh Roshan,Yogeeta Bali,Prem Chopra,NA,NA,NA,"CBI Inspector Kumar arrives home late one night, and watches in shock as his wife, Ashoo, being very intimate with another male. Enraged, he takes out his revolver and aims to shoot and kill both of them, but does not do so. Instead he fires a warning shot, and asks both of them to leave immediately. He does not permit Ashoo to take their only son, Prakash, with her. Kumar spends all the rest of his free time bringing up Prakash, and hating his wife. Years later, Prakash has grown up, and is now employed with a business firm, whose owner is Mohan. Prakash meets with Mohan's beautiful sister, Kiran, and falls in love with her. Kiran too is attracted to Prakash. What Prakash does not know is that Mohan is a gangster, with many aliases, and he also does not know that Mohan is the same male his mother had been having an affair with when he was a child.",5.5,18,https://www.imdb.com/title/tt0374079/
Meraa Dost Meraa Dushman,232080,1984,Action,NA,NA,Hindi,Shatrughan Sinha,Smita Patil,Geeta Behl,NA,NA,NA,"Shakti and Shaitan Singh are two brothers who belong to a gang of bandits, headed by the their dad, Bahadur Singh. One day while on a looting rampage in Jamalpur Village, Shakti is wounded and takes shelter with Harkishen and his daughter, Lali. He loses consciousness for several days, while the rest of the bandits think he is dead. When Shakti regains his senses he and Lali fall in love with each other, but Lali wants him to lead a honest life, and it is only then that he can marry her. Shakti decides to go straight to win Lali's hand, he decides to help a near-blind woman, Janki, to till her land. When Shaitan finds out that Shakti is still alive, he goes to welcome him back, but Shakti refuses to return. He refuses to return even when Bahadur comes to get him. Bahadur aims to shoot and kill Shakti, but someone shoots and kills Bahadur. An enraged Shaitan wants to find out his father's killer, and decides to kill one villager every week until Shakti and the villagers point out who the killer is. It is then Shaitan finds out that Shakti is not really his brother but someone who was abducted as a child from Jamalpur years ago. With the blood tie no longer in existence, looks like Shakti's days as a honest man are numbered, for no way is Shaitan going to spare him now.",4.8,18,https://www.imdb.com/title/tt0232080/
Numbri Aadmi,363851,1991,Action,Crime,Drama,Hindi,Ishrat Ali,Arun Bakshi,Rakesh Bedi,NA,NA,NA,"Rana (Amrish Puri) kills Inspector Anand Srivastav, and the only witness is Anand's son, Shankar. Years later, Shankar has grown up and has become a modern Robin Hood of sorts, robs the rich and distributes the wealth amongst the poor, especially a charitable hospital. Shankar comes to know that Rana is still alive, and attempts to avenge his father's death, only to find out that Rana has powerful friends, such as Assistant Commissioner of Police Vijay Pratap (Suresh Oberoi), who not only disbelief Shankar, but will prevent him from doing any harm to Rana.",4.3,24,https://www.imdb.com/title/tt0363851/
Kabhi Ajnabi Th,292036,1985,Romance,Sport,NA,Hindi,Poonam Dhillon,Sandeep Patil,Debashree Roy,NA,NA,NA,"Sandeep is a famous cricketer in love with Asha whose the daughter of a industrialist who wants her to marry to Shakti.But agree's to marry Asha to Sandeep,Sandeep tells Asha's father that his father is know more and he is living with his mother.Shakti who finds that Asha wont marry him breaks the news to Sandeep's father whose alive.During the meeting of Asha and Sandeep's parents Sandeep's real father turns up and tells that he is very much alive and his wife married another man due to his drinking habits which leaves Asha and her father upset as Sandeep didn't share the truth.Shakti finds Asha still loves Sandeep and sends goons to beat him who break his leg leaving his career in guise.Sandeep finds from Asha's father that she wont marry him anymore and leaves the town an moves to another place where he meets Geeta an aspiring singer.",5,20,https://www.imdb.com/title/tt0292036/
Sachein,453201,2005,Comedy,Drama,Romance,Tamil,Joseph Vijay,Genelia D'Souza,Bipasha Basu,NA,NA,NA,"Enroute overseas, Sachein reflects on his college life, his friends, as well as fellow-collegian, Shalinii, who he had instantly fallen in love with. She, too, is attracted to him, but is practical-minded and believes that true romance can only take place after a couple have known each other for some time. Both continue meeting but she is offended when she finds out that graffiti has linked their names together. She suspects his hand behind this, but he denies it, and she asks him to prove his love within 30 days. He sets about to woo her not realizing that their lives will undergo many changes after the entry of Gowtham/Singhania, and Manju - who is determined to make Sachein fall for her - while her parents have already made arrangements for her marriage with a male settled in Canada.",7.4,5899,https://www.imdb.com/title/tt0453201/
Smuggler,117672,1996,Action,Crime,NA,Hindi,Dharmendra,Ayub Khan,Eva Grover,Harshwardhan Y. Mohile,NA,NA,NA,4.3,22,https://www.imdb.com/title/tt0117672/
Chor Pe Mor,382604,1990,Comedy,Crime,NA,Hindi,Naseeruddin Shah,Karan Shah,Neelam Kothari,NA,NA,NA,"Raja, an aspiring musician, falls in love with Ritu against the wishes of her rich father. Meanwhile, Raja comes across some stolen cash which lands him in deep trouble and gets his friend, Anthony killed. Watch the full movie Chor Pe Mor online, only on Eros Now.",4.5,15,https://www.imdb.com/title/tt0382604/
Sarkari Mehman,371932,1979,Drama,Family,NA,Hindi,Vinod Khanna,Jasmin,Amjad Khan,NA,NA,NA,"Police Sub-Inspector Anand is known for his honesty, diligence and bravery. He single-handedly captures and arrests notorious smuggler and gangster Jack, has him sentenced to several years in prison. Then using plainclothes and a disguise as a Nawab, he entraps another notorious hoodlum named Gul Khan, and also has him arrested and sentenced to a long prison term. Although things go well with Anand at his work-place, things are not all that hunky-dory at home, as his wife, Rekha, who comes from a wealthy family, is unhappy about her new lower status in society and in the community, resulting in frequent arguments, with Anand threatening to kill her on several occasions. Then Anand comes to know about her having an affair Somesh and starts to follow her, hoping to catch them red-handed. Shortly after that Rekha and Somesh are found dead, and Anand is arrested for their murders. He is tried in court and sentenced to prison for life. Anand knows that he has not killed them, but in order to prove his innocence, he decides to escape from prison and catch the real killer(s). Before he could even plan his escape - he comes face to face with his foes - namely Jack and the seemingly invincible Gul Khan - who will kill him in a heartbeat.",4.8,17,https://www.imdb.com/title/tt0371932/
Fauji,1297447,1995,Action,Crime,Drama,Hindi,Master Altaf,Raj Babbar,Suresh Chatwal,NA,NA,NA,"Arjun lives a poor lifestyle in Madhopur along with his school-master dad, Bansilal, mom, and sister. His family is abused by Thakur Suryanarayan Singh's men and are forced to leave the region. Years later Arjun returns to avenge this humiliation but ends up getting arrested for killing a village belle, Tulsi, while his father gets killed by bandit Dhurjan Singh. Arjun is tried in Court, found guilty, and sentenced to life imprisonment, but with the help of another bandit, Shamsher Singh, escapes and kills Thakur Karan Singh. He then joins forces with Shamsher to kill Suryanarayan Singh and Dhurjan, who had earlier abducted and sexually molested, Lajwanti, Shamsher's betrothed and also killed Munna, his brother - little knowing that Suryanarayan has already enlisted the assistance of the Inspector General of Police to ensure their respective captures and arrests. And if that fails Suryanarayan also has another fail-safe plan that includes the deaths of both Arjun and Shamsher and an end to the threat on his life forever.",4.5,17,https://www.imdb.com/title/tt1297447/
Dilwale Kabhi Na Hare,400365,1992,Romance,NA,NA,Hindi,Rahul Roy,Prithvi,Nagma,Amar,Ramesh Sharma,NA,"Rahul and Vijay are close friends, and have been so for quite sometime. Rahul meets with attractive Anjali, and both fall in love. Vijay also meets with Anjali and he, too, falls in love with her. When Rahul finds out that his buddy loves the same woman, he decides to step aside and let Vijay marry Anjali. Then Anjali asserts herself and says that she will only marry Rahul. Both Rahul and Vijay are embittered and don't trust each other any more. To make matters worse, Rahul accidently loses his eyesight, but Anjali continues to stay by his side. It is then Vijay proposes a duel - he mixes poison in a glass of water, and plain water in another. The one who drinks the plain glass of water, gets to marry Anjali, and the other - death.",3.5,17,https://www.imdb.com/title/tt0400365/
Sarhad: The Border of Crime,114337,1995,Action,Crime,Drama,Hindi,Raj Babbar,Farha Naaz,Deepak Tijori,Anand Shinde,Pradeep Singh,NA,"Kundecha is a wealthy industrialist as well as the owner of around 40 branches of Kundecha Coop. Bank Ltd. He has booked all the lockers in all his banks branches and does not let any member of the public rent them. If anyone opposes his policy he reduces them to ashes through one of his gizmo's. One day he comes to a branch run by Mr. Chiklia to empty some of his lockers. Mr. Chiklia is not available but one of the pretty bank employee is, Sandhya Mathur. She immediately recognizes Kundecha and follows his instructions. Kundecha is fascinated by her beauty, and in his haste to depart, he drops a package behind. Sandhya picks it up and takes it home, only to have a rat gnaw through it and die. Her husband, Prakash, comes to know it is cocaine and reports it to the police. The next day the police officer disappears; Kundecha would like Sandhya to have sex with him, and if not her family will be killed. Faced with these dire prospects, Prakash, Sandhya, their daughter, Munni, and Prakash's unmarried brother must decide what's best for the family.",3.8,18,https://www.imdb.com/title/tt0114337/
Do Fantoosh,450608,1994,Comedy,NA,NA,Hindi,Sadashiv Amrapurkar,Vikas Anand,Ishita Babbar,NA,NA,NA,Kuldeep and Veerendra Kumar live like friend and family; while Veerendra works as a reporter for a local newspaper publication Kuldeep is busy collecting evidences against a gangster named Shetty. Kuldeep then hand these evidences over to Veerendra who then publishes a headline as well as photographs to expose Shetty. Shetty then retaliates by killing Kuldeep and getting Veerendra dismissed from his job - Veerendra then swears to avenge these injustices by defeating Shetty only to find himself arrested by the police for the rape and murder of a woman.,2.7,14,https://www.imdb.com/title/tt0450608/
Kalyug Ke Avtaar,400565,1995,Action,Romance,NA,Hindi,Jeetendra,Reena Roy,Madhoo,Mhatre,NA,NA,"Ailing multi-millionaire Pratap's mom gets him to promise that he will marry the first woman he sees the next morning, to which he agrees. The first woman he sees is Reena who comes from a poor family. Pratap proposes to her dad, and introduces Reena to his mom. The marriage is celebrated with great pomp and ceremony. Years later a son, Shyam, is born to them. When Shyam grows up he attends college and falls in love with fellow-collegian, Babli. When Pratap finds out that his son is in love, he meets and accepts Babli as his daughter-in-law right away. The only problem is Babli's brother, Dhamu Dada, who hates all millionaires, and is all set to oppose this marriage - tooth and nail.",3.2,18,https://www.imdb.com/title/tt0400565/
Hanuman Vijay,242502,1974,Fantasy,NA,NA,Hindi,Hercules,Ashish Kumar,Kanan Kaushal,NA,NA,NA,"Ahiravan was a powerful sorcerer who had mastered the dark arts, and ruled the netherworld (Patal) with his brother Mahiravan. He was a great devotee of Goddess Kamaksha from whom he had obtained vital occult secrets. After Meghnath and Kumbhakaran are killed in battle, Ravan summons Ahiravan to take care of Shri Ram and Lakshman once and for all. Ahiravan kidnaps both Ram and his brother Lakshman while they are sleeping and whisks them off to his subterranean kingdom Patalpuri where he holds them captive. He left behind, in place of their bed, a dark trail stretching deep into the bowels of the earth. When Hanuman learns of this, he dives into the tunnel and makes his way to Patal. There he finds the two brothers with their arms bound, ready to be sacrificed at the altar of Goddess Kamaksha. With the aid of some unlikely allies and his own wit, Hanuman saves the day once again.",7.4,15,https://www.imdb.com/title/tt0242502/
The Search,267924,1981,Drama,NA,NA,Hindi,Om Puri,Kanhu Bandhopodhyay,Tapti Bhatachrjee,NA,NA,NA,"Surendra (Om Puri), having been exiled from his village in youth and established himself in the city, comes back to the news of his father's demise, reportedly at the hands of a phantom. He announces a prize for anyone who succeeds in showing him a ghost, which attracts the greed of the poor hungry peasants,resulting in the accusations of innocent people as haunted and even murders with the hope of producing a ghost.",6.9,13,https://www.imdb.com/title/tt0267924/
Amma,2619760,1986,Drama,NA,NA,Hindi,Rakhee Gulzar,Mithun Chakraborty,Suresh Oberoi,NA,NA,NA,"On The Day Of Marriage Of Shanta (Rakhi Gulzar) & Prabin (Suresh Oberoi) The Police Raides The House, But They Do Not Find Nabin (Mithun Chakraborty) Who Is Prabin'S Younger Brother. The Reason For Nabin'S Crime Is Not Disclosed. Then Nabin Meets Shanta In The Bus, But The Police Attacks The Bus And Nabin Escapes Again. Meantime, Prabin Wins The Case Of Their Old Ancestral Property. Nabin Meets Family Friend Suraj (Vijay Arora) And Knows About Shanta'S Delivery Of A Boy.",6.2,13,https://www.imdb.com/title/tt2619760/
Giri,2963004,2004,Action,Comedy,NA,Tamil,Arjun Sarja,Reema Sen,Ramya,NA,NA,NA,NA,5.7,117,https://www.imdb.com/title/tt2963004/
Kaagaz Ki Nao,230389,1975,Drama,NA,NA,Hindi,Sarika,Reena Ghosh,Master Mithu,NA,NA,NA,"A social drama, it tackles the contradictions prevalent in society. Kumar, a respectable wealthy man to the outside world, in fact leads a life of debauchery. His son is just the contrary to his father. In the clash of the paths, the boy makes his father confess to his crimes. The boy, has a happy re-union with his mother, whom he considered all along to be dead.",6.5,13,https://www.imdb.com/title/tt0230389/
Rivaaj,254737,1972,Drama,NA,NA,Hindi,Mala Sinha,Sanjeev Kumar,Shatrughan Sinha,NA,NA,NA,"Shekhar has fallen in love with the new priest's daughter, Lakshmi. Lakshmi's father divulges a secret...she was married and widowed as a teenager. Shekhar's mother objects to them getting married, and Lakshmi takes up the traditional role of a widow (white saris, no bangles, etc.) Shekhar instead marries Kamla, a woman of his mother's choice, and they have a daughter, Raji. Several years later, Kamla dies from cancer, while Raji is at a party. Unaware of her death, Raji gets a shock at her cremation (which she stumble upon by chance) when her father sets her on fire. Since then she becomes afraid of her father, thinking he'll burn her too. Even worse, she longs for a mother figure. Having gotten a quick spiel about reincarnation from her grandmother, Raji pictures her late mother in a rose. Lakshmi stumbles upon there by chance, and provides a voice, pretending to be her motehr. Will Shekhar find out about Lakshmi? Will the Grandmother? Will Raji believe Shekhar won't hurt her? Will Shekhar and Lakshmi get together? Watch the film and find out.",6.7,15,https://www.imdb.com/title/tt0254737/
Do Raha,408695,1971,Drama,NA,NA,Hindi,Anil Dhawan,Radha Saluja,Roopesh Kumar,NA,NA,NA,"This a story about a good idealistic writer who is in love with a girl who has loved him for what he is, an ideal Indian Man. But he gets waylaid with bad company and the desire to make quick money, after his marriage to her, thus neglecting the life of his wife and daughter. Things take the twist for the worse when he compromises the honor of his wife, which results in the murder of his employer - The story is all about who actually committed the murder and the question which this film raises is that women should not be dependent on men for their bread and butter as they are highly educated.",6.4,11,https://www.imdb.com/title/tt0408695/
Lagi Nahi Chhute Rama,11012374,2015,Drama,NA,NA,Bhojpuri,Kavya,Priyanka Pandit,Pawan Singh,NA,NA,NA,NA,NA,NA,https://www.imdb.com/title/tt11012374/
Hum Panchhi Ek Daal Ke,269344,1957,Drama,NA,NA,Hindi,Master Romi,Satish Vyas,Daisy Irani,M. Alagappan,M.T. Subbiah,V. Subbiah,"Rajendra Mehra is the only child of Rai Bahadur Kailalshnath, and studies in a school along with Nandu, Mehmood, Chatpat, Guru, and others. He decides to go on an outing with them, incurring the anger of his dad, who at first sends his servant, Dhamu, to bring him back. When Dhamu fails, he sends Mirza Usman, and when Mirza too fails to bring Rajendra home, Kailashnath himself sets out himself, but when he reaches them, he finds that the children have already left for home. Angered at his son for mixing with poor students, he decides to remove him from the school and have him taught at home - and the person he has recruited is none other than Shaktimaan Singh - a Circus Ringmaster. The question remains will Shaktimaan be able to appropriately discipline Rajendra?",6.7,13,https://www.imdb.com/title/tt0269344/
Gunahon Ka Faisla,243294,1988,Action,NA,NA,Hindi,Shatrughan Sinha,Dimple Kapadia,Chunky Panday,NA,NA,NA,NA,4.6,20,https://www.imdb.com/title/tt0243294/
Parde Ke Peechey,314487,1971,Action,NA,NA,Hindi,Vinod Mehra,Yogeeta Bali,Pran,NA,NA,NA,"The story is on how by the misuse of ancient beliefs and customs, cheats and anti-national, international crooks cheat gullible un-educated people. It starts with the police raiding an ancient haunted palace which is looked after by a gardener and his daughter Tara (Yogita Bali). Vinod Mehra is trying to unearth the purpose behind making the house haunted, as he suspects that it is being used for anti national activities. Bindu plays an investigating officer and the theme song ""Aaja Reh"" ,sung by the ghost rings a bell on criminal activities being perpetrated in the name of religion and marriages.",6,13,https://www.imdb.com/title/tt0314487/
Pardesi,2011180,1993,Action,NA,NA,Hindi,Mithun Chakraborty,Sumalatha,Varsha Usgaonkar,NA,NA,NA,"A judge sentences an innocent villager to death for a murder he didn't commit. He then meets his lookalike who had actually committed the murder and is guilt ridden upon finding out he had sentenced the wrong man to death. Out of guilt, he sets out to make amends by sending the criminal back to the man's village in his place.",5,24,https://www.imdb.com/title/tt2011180/
Sasural,451901,1984,Drama,Family,NA,Hindi,Arun Govil,Sadhana Singh,Bharat Bhushan,NA,NA,NA,NA,5.4,12,https://www.imdb.com/title/tt0451901/
Aafat,9025262,2019,Comedy,Drama,NA,Hindi,Anshul Chauhan,Pushtii Shakti,Chitrashi Rawat,NA,NA,NA,"They say marriages are made in heaven, but sometimes on planet Earth, you need a little help to find your ideal match. A young and good looking Ricky Malhotra is on the lookout for his ""perfect bride"". He is introduced to 5 beautiful prospects, but each of these firebrands pose a unique quirk that society stereotypically perceives to be an imperfection. Hairy, bald, foul-mouthed, overweight and a divorcee - together they are the Aafat that Ricky is greeted with. This drama is a hilarious yet thought-provoking take on arranged marriages and what society perceives to be ""perfect bride"" material.",6.5,215,https://www.imdb.com/title/tt9025262/
Andhi Gali,158465,1984,Drama,Thriller,NA,Hindi,Deepti Naval,Mahesh Bhatt,Anil Chatterjee,NA,NA,NA,Former naxalite who has deserted the movement lives in fear of running into old colleagues. In the meanwhile he pushes his wife for material gain into modelling and later seamier projects with tragic consequences. The story is told in flashback mode.,5.5,15,https://www.imdb.com/title/tt0158465/
