Title,IMDB ID,Date of release,Genre1,Genre2,Genre3,Language,Actor1,Actor2,Actor3,Crew1,Crew2,Crew3,Plot summary,IMDB rating,IMDB votes,IMDB URL
Railway Platform,48537,1955,Comedy,Drama,Romance,Hindi,Nalini Jaywant,Sheila Ramani,Johnny Walker,Randhir Mistry,Shyam,NA,"While passing through Andher Nagri, a long-distance train comes to an unexpected halt. Passengers, including Kavi and unemployed Ram, who is traveling with his widowed mother and sister, Vimla, alight to inquire from the Station Master. They are told that due to railways lines being washed away, the train has been delayed for 24 hours. A businessman, Nasibchand, and his wife, quickly make their way to a nearby business, owned by Naina and her widowed father, and rent it for the day. Hoping to profit by selling food and water to stranded passengers, he hires passengers who can cook and draw water from the well and sell it to other passengers. Ram becomes the local hero when he rescues Naina from the well, and she falls in love with him. Little does she know that he will soon make plans to wed Rajkumari Indira - the runaway daughter of Raja Adiraj - a decision that will change everyone's lives - while others, including a Pandit and a thief, prepare to carry out their very own respective agendas.",7.2,28,https://www.imdb.com/title/tt0048537/
Maa Aur Mamta,175874,1970,Drama,NA,NA,Hindi,Nutan,Ashok Kumar,Nirupa Roy,NA,NA,NA,"Father Henry (Rehman) entrusts a newly-born infant in the care of an unwed Maya (Nutan), leaving her to explain the presence of the child. She is literally thrown out of the village and runs away to Bombay. There she is taken care of by a kind-hearted Muslim taxi-driver (Jayant). Years later, the child grows up to be called Ram (Jeetendra), but the question haunting everyone's mind is who is Ram's biological father?",7.4,34,https://www.imdb.com/title/tt0175874/
Char Dervesh,440196,1964,Adventure,Fantasy,NA,Hindi,Feroz Khan,Sayeeda Khan,Mukri,NA,NA,NA,"Khamer Bhakt is a handsome young man, who lives with only motive in mind - trouble. And he does negatively effect lives of his two brothers, Karim and Rahim, as well as others in the community. One day he ventures into the private chambers of the Shehzadi Nargis Banu, and incurs the wrath of the palace king and his guards. But Nargis has him forgiven, for both have fallen in love with each other. She announces in the palace that she will marry a man, who will bring back her missing sister, Hamida, and Khamer accepts the challenge. He goes through an evil magician, and does rescue Hamida, but ends up making a promise to Marjina, a shape-changing snake, that he will only love and marry Hamida, and fulfill her every wish, or else he will be cursed for life. The palace and it's people are overjoyed to see Hamida back, and arrangements are made for Nargis to get married to Khamer. Khamer now realizes that if he marries Nargis, he will be cursed; and if he marries Hamida, then he will break his vow to Nargis, and so the ultimate choice is on Khamer, as he has to decide what is best for him.",6.5,25,https://www.imdb.com/title/tt0440196/
Sun Sajna,430647,1982,Drama,Family,Romance,Hindi,Mithun Chakraborty,Ranjeeta Kaur,Iftekhar,NA,NA,NA,"On the scenic mountain town of Madhopur lives a lively and vivacious young woman named Basanti, who runs a business ""Basanti's Shop"" by selling novelties and dolls, along with her aged father. She meets Raj Kumar, a singer, during one of his shows at the nearby Hotel Tin Min, and both fall in love. They plan to get married, but before that Raj has to perform a show in Bombay, as well as bring his mother over to introduce her to Basanti. Raj never returns. A close friend of the family, Gopi, goes to the city to locate Raj, as Basanti's health is fast deteriorating. He finds Raj singing in a hotel room surrounded by scores of female fans. Enraged at this betrayal, he later storms into Raj's hotel room - only to find out the devastating truth as to why Raj chose to stay away from Basanti.",6.3,25,https://www.imdb.com/title/tt0430647/
Hum Tere Ashiq Hain,378071,1979,Drama,NA,NA,Hindi,Jeetendra,Hema Malini,Amjad Khan,Y.L. Bagchi,Manas Biswas,Dadoo Mistry,"Recently widowed Thakur Vikram Singh left India the same time the British did along with his son, Anand, for England. Years later, Anand has grown up to be a doctor and travels to Bombay, India, to work together with Dr. Pradhan for six months, thereafter he must return home and get married to Lalita, who is the daughter of Thakur's Legal Advisor, Jackson. Six months go by and Anand does not return, the Thakur, along with Jackson and Lalita, also travel to India to bring him back. This is where they find out that Anand has been romancing Rajkumari Sanyogta and both are expected to get married soon. The Thakur is pleased with Anand's choice and gives his blessings to the young couple. Watch what happens when the Thakur finds out that Rajkumari is in fact a flower-selling belle from his hometown of Balrampur, and Anand may not be his son after all.",6.4,29,https://www.imdb.com/title/tt0378071/
Amaanat,109091,1994,Action,Drama,NA,Hindi,Sanjay Dutt,Akshay Kumar,Heera Rajgopal,Anand Kalekar,NA,NA,"Vijay lives in village where people do not have enough water to drink ,Vijay decides to go to Bombay and purchase tube wells which will bring water to his village upon reaching Bombay Vijay's money gets stolen and he his left helpless one night he comes to aid of Amar whose beaten by goons soon they become friends and Vijay starts living with Amar,but what will happen when Vijay will find out that Amar is the same person who robbed his money.",4.7,569,https://www.imdb.com/title/tt0109091/
Love in Bombay,2306635,1974,Drama,Romance,NA,NA,Joy Mukherjee,Waheeda Rehman,Zeenat Aman,NA,NA,NA,Badal is a diver whose life revolves around his Horse Cheetah a captain of a ship notices him in mid sea an offers him work.The ship is carrying its owner Mehra and his daughter Preeti who has a tiff with Badal an is held captive for misbehaving with Preeti and her fiance Roshan.One night the ship gets stuck in the storm and Preeti is saved an bought to the shore of an Gilbert island by Badal on the island Mehra and captain wanted to recover hidden treasure and Badal was hired for same purpose.But Captain betrays Mehra and the tribal attack everyone leaving only Preeti and Badal on the island they fall in love and Roshan returns back to take Preeti leaving Badal to die on island.Badal then reaches Bombay in search of Preeti and comes across Ganpatrao who promises him help Badal reaches Preeti's house but Mr Mehra tells him that in order to marry her he should first earn Five Lakh's in three months which he accepts.,6,25,https://www.imdb.com/title/tt2306635/
Preetam,14045622,2021,Romance,NA,NA,Marathi,Pranav Raorane,Nakshatra Medhekar,Upendra Limaye,NA,NA,NA,NA,7.6,30,https://www.imdb.com/title/tt14045622/
Sangram,244182,1950,Drama,NA,NA,Hindi,Ashok Kumar,Nalini Jaywant,Shashi Kapoor,NA,NA,NA,NA,6.7,36,https://www.imdb.com/title/tt0244182/
Anjane Mein,389759,1978,Drama,Family,NA,Hindi,Rishi Kapoor,Neetu Singh,Nirupa Roy,Abu Hassan Mistry,NA,NA,NA,6.9,44,https://www.imdb.com/title/tt0389759/
Apne Huye Paraye,357433,1964,Drama,Family,NA,Hindi,Mala Sinha,Manoj Kumar,Shashikala,NA,NA,NA,"Rekha lives a middle-class lifestyle with her widowed mom. When she is five, her mom's friend, Nalini, passes away, compelling 5 year old Lata and her maid, Rampyari, to move in with them. Rekha is friendly with Shankar, and is sad when his family re-locates to Kanpur. Years later Rekha has matured, Shankar has returned as a qualified doctor, and asks her mom for Rekha's hand in marriage, to which she agrees. Before the engagement could take place, Rampyari finds that Shankar is having an affair with Lata, compelling both of them to get married, leaving Rekha heart-broken. After the marriage, Lata moves out to live with Shankar, and Rekha's mom passes, leaving her a heavily mortgaged house and many debts. Rekha's re-pays the debts and moves out to live her family servant, Fohkat, his son, Makhan, and Makhan's wife, Misri. Rekha finds employment and falls seriously ill. Shankar comes to treat her and asks her to come and live with them. When Rekha refuses, Lata comes over and makes her change her mind, and as a result both Fohkat and Rekha move in Shankar's house - not realizing that their entry will result in a murder in the household - which will not only turn everyone's lives upside down but also throw open their individual lives to a public scandal.",6.1,25,https://www.imdb.com/title/tt0357433/
Mitti,446159,2001,Action,Drama,NA,Hindi,Ferdous Ahmed,Sharbani Mukherji,Rani Rajkumar,Manohar Patil,NA,NA,"Ganga is sexually molested, assaulted, tortured and killed by a goon employed by Pagla Jaan, a Kolkata-based notorious gangster, whose wealth, power, and influence are beyond imagination. Deva undertakes to locate the killer, succeeds in his mission and beheads him publicly. Deva does not know that soon his friends' and family's lives will be endangered, and he, himself, will be hunted down - not only by an enraged Pagla Jaan and his army of goons - but also by the Police.",5.2,30,https://www.imdb.com/title/tt0446159/
Prem Tapasya,262703,1983,Drama,Romance,NA,Hindi,Jeetendra,Rekha,Reena Roy,G. Mogavesh,P. Satyanarayana,J. Suryanarayana,"Mohan Verma meets with attractive Devi and falls in love with her. His parents would prefer that he marry Anita, but he refuses to do so. He proposes his love for Devi, but Devi rejects, and even humiliates him. When Devi comes to know that Mohan really loves her with his heart and soul, she repents, and accepts Mohan's proposal for marriage. The marriage is set to take place within a few days, and preparations are on. Then Devi's brother, Nandlal, comes across a secret about Mohan's life, and puts a stop to this marriage. Devi finds out that her brother is behind this, and tells Mohan, and they plan to get married in secret. That night Mohan does not show up, and Devi is devastated. Fearing that he may have been involved in an accident, she contacts him and finds out that he was out with another woman, a woman named Laila.",6.1,30,https://www.imdb.com/title/tt0262703/
Kotwal Saab,244596,1977,Action,Crime,Drama,Hindi,Shatrughan Sinha,Aparna Sen,Sudhir,Ram Gopal Sharma,NA,NA,"Bharat Prasad Sharma lives a middle-class lifestyle along with his brother in a small town in India. His brother falls in love with Saraswati and both get intimate. Then Saraswati gets pregnant and both get married. Bharat does not approve of Saraswati and breaks off all relations, even dividing the house into two. Now Bharat is the Deputy Superintendent of Police and is assigned to take charge of a Police Station in a small town that is being ruled by a criminal don and soon-to-be Member of the Legislative Assembly, Dharam Kohli. Immediately upon his arrival he dramatically suspends Inspector Thakur, and arrests Dharam - only to release him due to medical reasons. A frustrated Bharat volunteers to go under cover and expose Dharam. He rents a room with John Fernandes, falls in love with co-tenant, Prabha, and marries her. With Prabha and John's help he gathers enough evidence to arrest Dharam little knowing that Prabha has a secret she kept from him - namely that she was in love with Dharam's goon, Mahesh, who is secretly blackmailing her and now wants her to hand over all evidence to him.",6,31,https://www.imdb.com/title/tt0244596/
Baadal,339998,1985,Drama,Family,NA,Hindi,Shammi Kapoor,Mithun Chakraborty,Poonam Dhillon,Anand Sawant,NA,NA,NA,5.7,24,https://www.imdb.com/title/tt0339998/
Gangvaa,362674,1984,Action,Drama,NA,Hindi,Rajinikanth,Shabana Azmi,Sarika,NA,NA,NA,"Gangvaa (Rajnikant) stays with his parents and brother in a village. His father works for Thakur Mahendra Singh (Amrish Puri). While digging for a well his father and other men get treasure. His father tells Thakur to give it to the government but Thakur doesn't listen. Gangvaa's father complains in police but Thakur comes out from jail with the help of a lawyer. He asks his Munim to kill Gangvaa's parents. When Gangvaa comes to know about his parents death he takes revenge and kills Thakur Mahendra Singh. Then Gangvaa, his brother Bhima and his friends become dakus.",5.4,31,https://www.imdb.com/title/tt0362674/
Bhagam Bhag,155541,1956,Action,Comedy,Crime,Hindi,Kishore Kumar,Shashikala,Smriti Biswas,NA,NA,NA,"Asleep in their shanty room in Bombay, Kishore and Bhagwan, are awoken by three males who insist on searching their room at gun-point for a coat - albeit in vain. When Bhagwan finds the coat, there appears nothing valuable in it, but they decide to keep it. Their privacy is interrupted again - this time by two females, Smriti and Shashi, who distract them and take the coat. The duo follow the two women, who turn out to be nieces of Jwala Prasad, the owner of the coat. Goons manage to take the coat, but with Kishore and Bhagwan's help, the women are able to take it back to their uncle. A grateful Jwala Prasad lets the duo stay with them. The next morning the duo will wake up to nothing but surprises - as they will find Jwala Prasad and his nieces are gone. They decide to investigate further but their resolve will set off a chain of events that will take the two friends - first to Madras, then to Howrah, and then to Pakistan - where they will be held in a dungeon and goons will prepare nooses to hang them - without the hapless duo even knowing what is in the coat and why so many people want to obtain it.",6,27,https://www.imdb.com/title/tt0155541/
Ulta Seedha,245525,1985,Comedy,NA,NA,Hindi,Raj Babbar,Rati Agnihotri,Aruna Irani,Y.L. Bagchi,Dilip Singh,NA,"Justice M.K. Roy is a traditional and orthodox gentleman, who is unable to understand nor appreciate the carelessness of today's youth. He has brought up his daughter, Shobha, with these same traditions, and he hopes to get her married in a good household. To his shock and dismay, Shobha is in love with Ramesh Saxena, an unemployed youth, who has no respect for tradition. Justice Roy is opposed to any alliance with Ramesh in any way whatsoever, until and unless Ramesh gets a suitable and respectable job, and learns to respect tradition. Ramesh does get a job with a textile mill, and gets a bonus payment, which is to be presented to him in an open ceremony, presided over by Justice Roy. When the bonus payment is being handed over to Ramesh, a woman comes forward and claims that Ramesh is her husband, who had abandoned her soon after their marriage.",5.3,25,https://www.imdb.com/title/tt0245525/
Aulad,233255,1968,Comedy,Drama,NA,Hindi,Jeetendra,Babita Kapoor,Mehmood,NA,NA,NA,"Mamta lives a poor lifestyle with her husband, Dinu, and two sons, Mohan, and Sohan. When Ram Lal, the wealthy Zamindar, Kanta Prasad Gupta's Munim, comes to them to take Sohan to Mrs. Sharda Gupta for ten days, they reluctantly permit him to do so. After 10 days, Gupta himself approaches them and begs them to let his wife keep Sohan for life. They tearfully agree. Then Mohan gets into trouble, and Dinu scolds him, only to find out that Mohan has run away from home. A search proves futile, and the couple continue to live a childless life. Now 17 years later, Mamta is seriously ill, and asks Dinu to bring Sohan back. Dinu goes to the Zamindar's house where he meets a young man who identifies himself as the real son, Suraj, and informs him that Sohan has been asked to leave. A devastated Dinu loses his memory and roams listlessly on the streets of Calcutta, unable to remember anything. The question is will Dinu and Mamta be united with their sons during their respective lifetime, and what has become of Mohan, and who exactly is Suraj?",5.3,35,https://www.imdb.com/title/tt0233255/
Safed Jhoot,158179,1978,Comedy,Drama,Family,Hindi,Ashok Kumar,Vinod Mehra,Mithu Mukherjee,NA,NA,NA,"After the death of their parents, Kamla Gulati and her elder brother live together and assist each other. Soon her brother gets a job and they move up in life. Then Kamla elopes with a young man and leaves her brother without informing him of her whereabouts. Shortly thereafter her pregnant body is found lifeless, abandoned by her boyfriend. Now Gulati is the President of an organization, and has promoted young Vinod Thakur as it's Vice-President. Gulati goes for a holiday in Panchgani and upon arrival at the local Circuit House meets with a young woman who identifies herself as Vinodini T. Gulati, the daughter of T.N. Gulati. He starts treating her as his sister and becomes very protective toward her. When he finds out that a young man named Amol Palekar alias Ramu is attempting to woo her, he forbids her to see or have any contact with him in any way, as he fears that she may end up like Kamla. He is headed for several surprises as he will soon find out that Vinodini is not who she claims to be, that, in fact, she is married, and her real husband is attempting to free her from the clutches of Mr. Gulati, by hook or by crook - even enlisting the services of local goon Pandu Dada - who has been known to kill in order to get his way.",5.6,28,https://www.imdb.com/title/tt0158179/
Kasak,154720,1992,Drama,Romance,NA,Hindi,Aparajita,Asrani,Laxmikant Berde,NA,NA,NA,NA,5.1,33,https://www.imdb.com/title/tt0154720/
Ganga Tere Desh Mein,359309,1988,Action,NA,NA,Hindi,Dharmendra,Jaya Prada,Shatrughan Sinha,S.R. Rani,NA,NA,"Inspector Ajay lives with his widowed mother in a city in India. He has been assigned the task of bringing in notorious bandit and gangster named Cobra, who has been terrorizing and killing people all over India. He does succeed in arresting him, and holds him in a cell, only to find out that he is insane, and must be institutionalized. Thereafter, Ajay awaits Cobra's treatment so that he can proceed with his investigation. One day while his mother packs his lunch, he finds out that it was poisoned, it did not affect him, but it kills another colleague. His mother, relieved to find out that Ajay is alright, is more concerned about Cobra, who was also sent some food. Ajay is baffled as to why his mother would feed a senile criminal, and he sets out to find out why. The truth will devastate him, make him lose his job, and change his outlook on life forever.",4.8,33,https://www.imdb.com/title/tt0359309/
Lava,89465,1985,Family,Drama,NA,Hindi,Raj Babbar,Dimple Kapadia,Asha Parekh,NA,NA,NA,"Amar lives a poor lifestyle with his widowed mom in India, he is unemployed, does not make enough effort to find a job, and spends most of his time with his sweetheart, Rinku Dayal. When his mom finds out that he has been writing love letters, she asks him to introduce his girlfriend, which he does. She approves of Rinku and would like both of them to get married, she also warns Rinku that Amar is fated to die under water and must keep away from all lakes, rivers, and swimming pools at all costs, as he cannot swim. Then a few days later, Amar accidentally falls down in a river, is swept through a waterfall and is believed to be dead. His shocked and devastated mom loses her sanity, and keeps on hoping that Amar will return one day. Then six months later, Amar does return home to his overjoyed mom, and is anxious to go to Rinku and tell her the good news. It is then his mom informs him that Rinku has married Ajit Verma, her dad's boss, shortly after she found out that Amar had drowned. A shocked Amar must now find out why his sweetheart chose to marry a wealthy man, and it is here he will find out that his falling in the river was not an accident but he was the victim of a conspiracy against him.",5.5,33,https://www.imdb.com/title/tt0089465/
Jallad No. 1,354662,2000,Action,Drama,NA,Hindi,Ishrat Ali,Dharmendra,Shakti Kapoor,NA,NA,NA,"Shankar (Dharmendra) is an executioner at a local police station. He lost respect for his job, as he was forced to execute an innocent man, who was framed by the Underworld for committing the murder of a Police Commissioner. He quit his job and was unable to find jobs at other places, as the employers were concerned about their own safety. In a desperate need for money, he approached Shinde (Shakti Kapoor) for a job. Shinde, with the help of Senior Inspector Dolkar was involved in the trade of arms. Shinde framed Shankar for his deeds and was arrested by Inspector Arjun (Kiran Kumar). The court sentenced him to prison. Since then, vengeance against the criminals was Shankar's prime objective.",4.6,30,https://www.imdb.com/title/tt0354662/
Shabnam,155161,1964,Action,Adventure,Comedy,Urdu,Mehmood,L. Vijayalakshmi,Sheikh Mukhtar,NA,NA,NA,"Khalifa Haroon instructs his daughter, Shabnam, to keep her face in a veil as she resembles Shubi, the region's Shehzadi. With soldiers under the command of Siparsala Zaber terrorizing the folks, a masked man comes out of nowhere to combat them, and people believe that he is the once-dead Zingarro. Shubi is displeased when she finally gets to meet her future husband, Khan Mustafa, as he is a cowardly buffoon. When Zaber finds out that he cannot control the Maharaja and the Wazir, he has the former imprisoned and the latter killed. When he is unable to influence Shubi, he has her kidnapped, and has Shabnam brought to the palace forcibly where he hopes to lure her to become the Shehzadi and marry him.",5.4,24,https://www.imdb.com/title/tt0155161/
Sauda,395748,1995,Romance,NA,NA,Hindi,Sumeet Saigal,Neelam Kothari,Vikas Bhalla,NA,NA,NA,"Deepak (Vikas Bhalla) and Jyoti (Neelam Dharamdas) are in love, against her wealthy father's wishes. When Seth Dharamdas (Dalip Tahil) has Deepak assaulted, Jyoti rebels and marries him. They move in with his sister, Asha, and her husband, Madan, who is an investment banker. On request of Shakti Singh (Kiran Kumar), he invests two and a half million in real estate, only to find out he has been swindled out of the money. Deepak sells his ancestral property, only to be robbed. The funds must be replaced in 24 hours, when they meet Prakash (Sumeet Saigal). He makes an indecent proposal to Jyoti, spend one night with him in exchange for the money.",3.8,30,https://www.imdb.com/title/tt0395748/
Baali Umar Ko Salaam,363455,1994,Action,Comedy,Drama,Hindi,Kamal Sadanah,Tisca Chopra,Sudha Chandran,NA,NA,NA,"Rahul lives a wealthy lifestyle in Mumbai along with his dad, Banwarilal Ansimal and mom, and is a big disappointment to his parents. They want him to get married, he refuses, and gets grounded. Shortly thereafter, Banwarilal finds out Rahul has managed to escape, and launches a search for him. A few months later, Rahul telephones his mother, that he is alive and well, and has found a sweetheart, Nikita, who he wants to marry. His mother accepts this and wants him to return home immediately. Neither know that Banwarilal does not approve of his son choosing a bride on his own, and has already made arrangements with his wealthy Himachal Pradesh-based childhood friend, Jaalan, for Rahul's marriage.",4.2,32,https://www.imdb.com/title/tt0363455/
Chauraha,346733,1994,Action,Crime,Drama,Hindi,Jeetendra,Jackie Shroff,Jaya Prada,Ramesh Abitkar,NA,NA,"Amar a 12 yr old orphan works in a hotel and at night, studies at Masterjis school Kalinath a pimp murders one of his customers and the innocent Amar is convicted instead of Kalinath. After many years, Amar (Jackie Shroff) returns after completing his sentence and finds everything changed. The school had made way for a gamble-house. He comes to know that Kalinath is dead and his son Baba Bhatti (Danny Denzongpa) is one of the leading criminals. Amar brings the crooks to book and the gamble-house now makes way for 'Insaaf Ghar'. Amar falls in love with Poonam (Ashwini Bhave), an honest inspector's sister. Amar comes across a poster of Badrinath, who is contesting the elections. He identifies him instantly, he is the pimp Kalinath, Amar and his friends Kidnap Kalinath alias Badrinath two days before the elections. What happens next? View 'CHAURAHA' to know the remaining part.",4,29,https://www.imdb.com/title/tt0346733/
Krishna Arjun,400584,1997,Drama,NA,NA,Hindi,Jeetendra,Vivek Mushran,Upasna Singh,NA,NA,NA,"Sharda Yadav is the widow of Ramnath, who was a freedom fighter. Now she lives a poor but very respectable lifestyle with her two sons, Krishna and Arjun, in a small rural town in India. Years pass by, Krishna and Arjun have both grown up. Krishna and his mom would like to send Arjun to Bombay to study and become a professional. Accordingly, Arjun travels to Bombay, where he resides in a hostel, meets a beautiful collegian named Punam, and both fall in love with each other. Then Arjun gets devastating news of the passing away of his mother. He travels home and finds that nothing is the same anymore, for Krishna has been arrested, found guilty of brutally raping and then killing a young school-teacher widow by the name of Meera, and unable to bear this shock of this disgrace, his mother has passed away. Arjun must now meet with Krishna and find out what had happened after he left town, and whether there is any truth to Krishna's crime.",6.6,28,https://www.imdb.com/title/tt0400584/
